{
  "schemaVersion": "emp.report.v1",
  "generatedAt": "2026-07-03T19:35:14.709Z",
  "project": {
    "name": "workspace",
    "root": "/workspace",
    "source": "local",
    "buildTools": [
      "Maven"
    ],
    "javaVersion": "1.8",
    "springBootVersion": "2.2.6.RELEASE",
    "fileCount": 45,
    "javaFileCount": 3
  },
  "pack": "spring-boot-3-readiness",
  "packApplicability": {
    "applicable": true,
    "confidence": 0.95,
    "reason": "Spring Boot 2.x was detected. This pack targets Spring Boot 2.x to 3.x migrations.",
    "targetVersion": "3.x"
  },
  "readiness": {
    "overall": 81,
    "categories": {
      "java": 88,
      "spring": 79,
      "hibernate": 72,
      "jakarta": 95,
      "build": 90,
      "security": 76,
      "testing": 63,
      "architecture": 84
    },
    "summary": "Ready with remediation work",
    "counts": {
      "critical": 0,
      "warning": 4,
      "info": 0
    }
  },
  "productionFindings": [
    {
      "code": "spring-boot-2",
      "severity": "warning",
      "title": "Spring Boot 2.2.6.RELEASE detected",
      "recommendation": "Plan Spring Boot 3 and Jakarta compatibility validation.",
      "file": null,
      "line": null,
      "scope": "production"
    }
  ],
  "testFindings": [
    {
      "code": "junit4-api-usage",
      "severity": "warning",
      "title": "JUnit 4 API usage",
      "recommendation": "Review JUnit 4 API usage before modernization.",
      "file": "backend/src/test/java/com/shekhargulati/app/ApplicationTests.java",
      "line": 3,
      "scope": "test"
    },
    {
      "code": "junit4-runner-usage",
      "severity": "warning",
      "title": "JUnit 4 runner usage",
      "recommendation": "Review JUnit 4 runner usage before modernization.",
      "file": "backend/src/test/java/com/shekhargulati/app/ApplicationTests.java",
      "line": 4,
      "scope": "test"
    },
    {
      "code": "junit4-runner-usage",
      "severity": "warning",
      "title": "JUnit 4 runner usage",
      "recommendation": "Review JUnit 4 runner usage before modernization.",
      "file": "backend/src/test/java/com/shekhargulati/app/ApplicationTests.java",
      "line": 8,
      "scope": "test"
    }
  ],
  "findingSummary": {
    "production": {
      "critical": 0,
      "warning": 1,
      "info": 0
    },
    "test": {
      "critical": 0,
      "warning": 3,
      "info": 0
    },
    "byCode": {
      "spring-boot-2": {
        "code": "spring-boot-2",
        "title": "Spring Boot 2.2.6.RELEASE detected",
        "severity": "warning",
        "total": 1,
        "production": 1,
        "test": 0,
        "topModules": [
          {
            "name": "project",
            "count": 1
          }
        ],
        "examples": [
          {
            "code": "spring-boot-2",
            "severity": "warning",
            "title": "Spring Boot 2.2.6.RELEASE detected",
            "recommendation": "Plan Spring Boot 3 and Jakarta compatibility validation.",
            "file": null,
            "line": null,
            "scope": "production"
          }
        ]
      },
      "junit4-api-usage": {
        "code": "junit4-api-usage",
        "title": "JUnit 4 API usage",
        "severity": "warning",
        "total": 1,
        "production": 0,
        "test": 1,
        "topModules": [
          {
            "name": "backend",
            "count": 1
          }
        ],
        "examples": [
          {
            "code": "junit4-api-usage",
            "severity": "warning",
            "title": "JUnit 4 API usage",
            "recommendation": "Review JUnit 4 API usage before modernization.",
            "file": "backend/src/test/java/com/shekhargulati/app/ApplicationTests.java",
            "line": 3,
            "scope": "test"
          }
        ]
      },
      "junit4-runner-usage": {
        "code": "junit4-runner-usage",
        "title": "JUnit 4 runner usage",
        "severity": "warning",
        "total": 2,
        "production": 0,
        "test": 2,
        "topModules": [
          {
            "name": "backend",
            "count": 2
          }
        ],
        "examples": [
          {
            "code": "junit4-runner-usage",
            "severity": "warning",
            "title": "JUnit 4 runner usage",
            "recommendation": "Review JUnit 4 runner usage before modernization.",
            "file": "backend/src/test/java/com/shekhargulati/app/ApplicationTests.java",
            "line": 4,
            "scope": "test"
          },
          {
            "code": "junit4-runner-usage",
            "severity": "warning",
            "title": "JUnit 4 runner usage",
            "recommendation": "Review JUnit 4 runner usage before modernization.",
            "file": "backend/src/test/java/com/shekhargulati/app/ApplicationTests.java",
            "line": 8,
            "scope": "test"
          }
        ]
      }
    }
  },
  "findings": [
    {
      "code": "spring-boot-2",
      "severity": "warning",
      "title": "Spring Boot 2.2.6.RELEASE detected",
      "recommendation": "Plan Spring Boot 3 and Jakarta compatibility validation.",
      "file": null,
      "line": null,
      "scope": "production"
    },
    {
      "code": "junit4-api-usage",
      "severity": "warning",
      "title": "JUnit 4 API usage",
      "recommendation": "Review JUnit 4 API usage before modernization.",
      "file": "backend/src/test/java/com/shekhargulati/app/ApplicationTests.java",
      "line": 3,
      "scope": "test"
    },
    {
      "code": "junit4-runner-usage",
      "severity": "warning",
      "title": "JUnit 4 runner usage",
      "recommendation": "Review JUnit 4 runner usage before modernization.",
      "file": "backend/src/test/java/com/shekhargulati/app/ApplicationTests.java",
      "line": 4,
      "scope": "test"
    },
    {
      "code": "junit4-runner-usage",
      "severity": "warning",
      "title": "JUnit 4 runner usage",
      "recommendation": "Review JUnit 4 runner usage before modernization.",
      "file": "backend/src/test/java/com/shekhargulati/app/ApplicationTests.java",
      "line": 8,
      "scope": "test"
    }
  ],
  "evidence": [
    {
      "name": "Build metadata",
      "status": "passed"
    },
    {
      "name": "Spring Boot version detection",
      "status": "passed"
    },
    {
      "name": "Jakarta namespace readiness",
      "status": "passed"
    },
    {
      "name": "Hibernate usage detection",
      "status": "warning"
    },
    {
      "name": "Spring Security usage detection",
      "status": "warning"
    },
    {
      "name": "JUnit 4 usage detection",
      "status": "passed"
    },
    {
      "name": "JUnit 5 usage detection",
      "status": "warning"
    },
    {
      "name": "Static source checks",
      "status": "warning"
    },
    {
      "name": "OpenRewrite dry-run readiness",
      "status": "pending",
      "note": "OpenRewrite execution is available through transform --engine openrewrite when Maven or Gradle execution is available."
    }
  ],
  "dependencies": {
    "springBootVersion": "2.2.6.RELEASE",
    "springSecurityVersion": "unknown",
    "jakartaDetected": false,
    "javaxDetected": false,
    "hibernateDetected": false,
    "springSecurityDetected": false,
    "junit4Detected": true,
    "junit5Detected": false
  },
  "nextActions": [
    {
      "id": "validate-spring-boot-upgrade-path",
      "priority": "warning",
      "title": "Validate the Spring Boot 3 upgrade path",
      "reason": "Spring Boot version evidence determines whether the Spring Boot 2 to 3 pack can support migration planning.",
      "evidenceCount": 1,
      "findingCodes": [
        "spring-boot-2",
        "spring-boot-version-unknown"
      ],
      "suggestedCommand": "node ./bin/emp.js transform . --pack spring-boot-3-readiness --mode dry-run --validate --out reports/spring-boot-trust"
    },
    {
      "id": "review-junit-5-migration-risks",
      "priority": "warning",
      "title": "Review JUnit 4 to JUnit 5 migration risks",
      "reason": "JUnit 5 readiness depends on explicit review of JUnit 4 APIs, runners, dependencies, and Vintage engine assumptions.",
      "evidenceCount": 0,
      "findingCodes": [
        "junit4-api-usage",
        "junit4-runner-usage",
        "junit4-dependency",
        "junit-vintage-engine"
      ],
      "suggestedCommand": "node ./bin/emp.js analyze . --pack junit-5-readiness --out reports/junit-5-readiness"
    }
  ]
}
