{
  "schemaVersion": "emp.report.v1",
  "generatedAt": "2026-07-03T19:35:16.597Z",
  "project": {
    "name": "workspace",
    "root": "/workspace",
    "source": "local",
    "buildTools": [
      "Maven"
    ],
    "javaVersion": "1.8",
    "springBootVersion": "2.6.0",
    "fileCount": 36,
    "javaFileCount": 2
  },
  "pack": "spring-boot-3-readiness",
  "packApplicability": {
    "applicable": true,
    "confidence": 0.95,
    "reason": "Spring Boot 2.x was detected. This pack targets Spring Boot 2.x to 3.x migrations.",
    "targetVersion": "3.x"
  },
  "readiness": {
    "overall": 83,
    "categories": {
      "java": 88,
      "spring": 79,
      "hibernate": 72,
      "jakarta": 95,
      "build": 90,
      "security": 76,
      "testing": 76,
      "architecture": 84
    },
    "summary": "Ready with remediation work",
    "counts": {
      "critical": 0,
      "warning": 1,
      "info": 0
    }
  },
  "productionFindings": [
    {
      "code": "spring-boot-2",
      "severity": "warning",
      "title": "Spring Boot 2.6.0 detected",
      "recommendation": "Plan Spring Boot 3 and Jakarta compatibility validation.",
      "file": null,
      "line": null,
      "scope": "production"
    }
  ],
  "testFindings": [],
  "findingSummary": {
    "production": {
      "critical": 0,
      "warning": 1,
      "info": 0
    },
    "test": {
      "critical": 0,
      "warning": 0,
      "info": 0
    },
    "byCode": {
      "spring-boot-2": {
        "code": "spring-boot-2",
        "title": "Spring Boot 2.6.0 detected",
        "severity": "warning",
        "total": 1,
        "production": 1,
        "test": 0,
        "topModules": [
          {
            "name": "project",
            "count": 1
          }
        ],
        "examples": [
          {
            "code": "spring-boot-2",
            "severity": "warning",
            "title": "Spring Boot 2.6.0 detected",
            "recommendation": "Plan Spring Boot 3 and Jakarta compatibility validation.",
            "file": null,
            "line": null,
            "scope": "production"
          }
        ]
      }
    }
  },
  "findings": [
    {
      "code": "spring-boot-2",
      "severity": "warning",
      "title": "Spring Boot 2.6.0 detected",
      "recommendation": "Plan Spring Boot 3 and Jakarta compatibility validation.",
      "file": null,
      "line": null,
      "scope": "production"
    }
  ],
  "evidence": [
    {
      "name": "Build metadata",
      "status": "passed"
    },
    {
      "name": "Spring Boot version detection",
      "status": "passed"
    },
    {
      "name": "Jakarta namespace readiness",
      "status": "passed"
    },
    {
      "name": "Hibernate usage detection",
      "status": "warning"
    },
    {
      "name": "Spring Security usage detection",
      "status": "warning"
    },
    {
      "name": "JUnit 4 usage detection",
      "status": "warning"
    },
    {
      "name": "JUnit 5 usage detection",
      "status": "passed"
    },
    {
      "name": "Static source checks",
      "status": "warning"
    },
    {
      "name": "OpenRewrite dry-run readiness",
      "status": "pending",
      "note": "OpenRewrite execution is available through transform --engine openrewrite when Maven or Gradle execution is available."
    }
  ],
  "dependencies": {
    "springBootVersion": "2.6.0",
    "springSecurityVersion": "unknown",
    "jakartaDetected": false,
    "javaxDetected": false,
    "hibernateDetected": false,
    "springSecurityDetected": false,
    "junit4Detected": false,
    "junit5Detected": true
  },
  "nextActions": [
    {
      "id": "validate-spring-boot-upgrade-path",
      "priority": "warning",
      "title": "Validate the Spring Boot 3 upgrade path",
      "reason": "Spring Boot version evidence determines whether the Spring Boot 2 to 3 pack can support migration planning.",
      "evidenceCount": 1,
      "findingCodes": [
        "spring-boot-2",
        "spring-boot-version-unknown"
      ],
      "suggestedCommand": "node ./bin/emp.js transform . --pack spring-boot-3-readiness --mode dry-run --validate --out reports/spring-boot-trust"
    }
  ]
}
