{
  "schemaVersion": "emp.report.v1",
  "generatedAt": "2026-07-03T15:43:04.890Z",
  "project": {
    "name": "workspace",
    "root": "/workspace",
    "source": "local",
    "buildTools": [
      "Maven"
    ],
    "javaVersion": "11",
    "springBootVersion": "2.5.5",
    "fileCount": 13,
    "javaFileCount": 7
  },
  "pack": "spring-boot-3-readiness",
  "packApplicability": {
    "applicable": true,
    "confidence": 0.95,
    "reason": "Spring Boot 2.x was detected. This pack targets Spring Boot 2.x to 3.x migrations.",
    "targetVersion": "3.x"
  },
  "readiness": {
    "overall": 82,
    "categories": {
      "java": 86,
      "spring": 79,
      "hibernate": 84,
      "jakarta": 79,
      "build": 90,
      "security": 76,
      "testing": 76,
      "architecture": 84
    },
    "summary": "Ready with remediation work",
    "counts": {
      "critical": 1,
      "warning": 1,
      "info": 1
    }
  },
  "productionFindings": [
    {
      "code": "spring-boot-2",
      "severity": "warning",
      "title": "Spring Boot 2.5.5 detected",
      "recommendation": "Plan Spring Boot 3 and Jakarta compatibility validation.",
      "file": null,
      "line": null,
      "scope": "production"
    },
    {
      "code": "javax-usage",
      "severity": "critical",
      "title": "javax namespace usage detected",
      "recommendation": "Migrate Java EE imports to Jakarta equivalents for Spring Boot 3.",
      "file": null,
      "line": null,
      "scope": "production"
    },
    {
      "code": "java-util-date",
      "severity": "info",
      "title": "java.util.Date usage",
      "recommendation": "Review java.util.Date usage before modernization.",
      "file": "src/main/java/com/example/easynotes/model/Note.java",
      "line": 10,
      "scope": "production"
    }
  ],
  "testFindings": [],
  "findingSummary": {
    "production": {
      "critical": 1,
      "warning": 1,
      "info": 1
    },
    "test": {
      "critical": 0,
      "warning": 0,
      "info": 0
    },
    "byCode": {
      "spring-boot-2": {
        "code": "spring-boot-2",
        "title": "Spring Boot 2.5.5 detected",
        "severity": "warning",
        "total": 1,
        "production": 1,
        "test": 0,
        "topModules": [
          {
            "name": "project",
            "count": 1
          }
        ],
        "examples": [
          {
            "code": "spring-boot-2",
            "severity": "warning",
            "title": "Spring Boot 2.5.5 detected",
            "recommendation": "Plan Spring Boot 3 and Jakarta compatibility validation.",
            "file": null,
            "line": null,
            "scope": "production"
          }
        ]
      },
      "javax-usage": {
        "code": "javax-usage",
        "title": "javax namespace usage detected",
        "severity": "critical",
        "total": 1,
        "production": 1,
        "test": 0,
        "topModules": [
          {
            "name": "project",
            "count": 1
          }
        ],
        "examples": [
          {
            "code": "javax-usage",
            "severity": "critical",
            "title": "javax namespace usage detected",
            "recommendation": "Migrate Java EE imports to Jakarta equivalents for Spring Boot 3.",
            "file": null,
            "line": null,
            "scope": "production"
          }
        ]
      },
      "java-util-date": {
        "code": "java-util-date",
        "title": "java.util.Date usage",
        "severity": "info",
        "total": 1,
        "production": 1,
        "test": 0,
        "topModules": [
          {
            "name": "src",
            "count": 1
          }
        ],
        "examples": [
          {
            "code": "java-util-date",
            "severity": "info",
            "title": "java.util.Date usage",
            "recommendation": "Review java.util.Date usage before modernization.",
            "file": "src/main/java/com/example/easynotes/model/Note.java",
            "line": 10,
            "scope": "production"
          }
        ]
      }
    }
  },
  "findings": [
    {
      "code": "spring-boot-2",
      "severity": "warning",
      "title": "Spring Boot 2.5.5 detected",
      "recommendation": "Plan Spring Boot 3 and Jakarta compatibility validation.",
      "file": null,
      "line": null,
      "scope": "production"
    },
    {
      "code": "javax-usage",
      "severity": "critical",
      "title": "javax namespace usage detected",
      "recommendation": "Migrate Java EE imports to Jakarta equivalents for Spring Boot 3.",
      "file": null,
      "line": null,
      "scope": "production"
    },
    {
      "code": "java-util-date",
      "severity": "info",
      "title": "java.util.Date usage",
      "recommendation": "Review java.util.Date usage before modernization.",
      "file": "src/main/java/com/example/easynotes/model/Note.java",
      "line": 10,
      "scope": "production"
    }
  ],
  "evidence": [
    {
      "name": "Build metadata",
      "status": "passed"
    },
    {
      "name": "Spring Boot version detection",
      "status": "passed"
    },
    {
      "name": "Jakarta namespace readiness",
      "status": "failed"
    },
    {
      "name": "Hibernate usage detection",
      "status": "passed"
    },
    {
      "name": "Spring Security usage detection",
      "status": "warning"
    },
    {
      "name": "JUnit 4 usage detection",
      "status": "warning"
    },
    {
      "name": "JUnit 5 usage detection",
      "status": "passed"
    },
    {
      "name": "Static source checks",
      "status": "warning"
    },
    {
      "name": "OpenRewrite dry-run readiness",
      "status": "pending",
      "note": "OpenRewrite execution is available through transform --engine openrewrite when Maven or Gradle execution is available."
    }
  ],
  "dependencies": {
    "springBootVersion": "2.5.5",
    "springSecurityVersion": "unknown",
    "jakartaDetected": false,
    "javaxDetected": true,
    "hibernateDetected": true,
    "springSecurityDetected": false,
    "junit4Detected": false,
    "junit5Detected": true
  },
  "nextActions": [
    {
      "id": "plan-jakarta-migration",
      "priority": "critical",
      "title": "Plan javax to Jakarta namespace migration",
      "reason": "Modern Spring Boot and Hibernate migration paths require Jakarta namespace readiness.",
      "evidenceCount": 1,
      "findingCodes": [
        "javax-usage"
      ],
      "suggestedCommand": "node ./bin/emp.js analyze . --pack jakarta-readiness --out reports/jakarta-readiness"
    },
    {
      "id": "validate-spring-boot-upgrade-path",
      "priority": "warning",
      "title": "Validate the Spring Boot 3 upgrade path",
      "reason": "Spring Boot version evidence determines whether the Spring Boot 2 to 3 pack can support migration planning.",
      "evidenceCount": 1,
      "findingCodes": [
        "spring-boot-2",
        "spring-boot-version-unknown"
      ],
      "suggestedCommand": "node ./bin/emp.js transform . --pack spring-boot-3-readiness --mode dry-run --validate --out reports/spring-boot-trust"
    }
  ]
}
